<?xml version="1.0" encoding="UTF-8"?>
<xs:schema xmlns:xs="http://www.w3.org/2001/XMLSchema" xmlns:xsd="http://www.w3.org/2001/XMLSchema"
	elementFormDefault="qualified" xmlns:mpb="http://www.ftn.uns.ac.rs/xws/xsd/mpb"
	targetNamespace="http://www.ftn.uns.ac.rs/xws/xsd/mpb"
	xmlns:jxb="http://java.sun.com/xml/ns/jaxb" jxb:version="2.0"
	xmlns:cmn="http://www.ftn.uns.ac.rs/xws/xsd/common">

	<xs:annotation>
		<xs:appinfo>
			<jxb:globalBindings collectionType="java.util.ArrayList"/>
			<jxb:schemaBindings>
				<jxb:package name="rs.ac.uns.ftn.xws.domain"/>
			</jxb:schemaBindings>
		</xs:appinfo>
	</xs:annotation>

	<xsd:import namespace="http://www.ftn.uns.ac.rs/xws/xsd/common"
		schemaLocation="../xsd/common.xsd"/>


	<xs:complexType name="Company">
		<xs:sequence>
			<xs:element name="accountNumber" type="cmn:AccountNumber"/>
			<xs:element name="balance" type="xs:decimal"/>
			<xs:element name="reservedAmount" type="xs:decimal"/>
			<xs:element name="wsUrl" type="xs:string"/>
		</xs:sequence>
	</xs:complexType>
	<xs:complexType name="CompanyData">
		<xs:sequence>
			<xs:element maxOccurs="unbounded" name="company" type="mpb:Company"/>
		</xs:sequence>
	</xs:complexType>
	<xs:element abstract="false" name="companyData" type="mpb:CompanyData"/>
</xs:schema>
